{
  "android_root": "D:/Myfiles/a2h/arkts-migration/harmony-migration-toolkit",
  "edges": [
    {
      "determinism": "rule",
      "edge_id": "e:product_root:feature:generated.minimal.fixtures:parent_of:0",
      "from": "product_root",
      "rel": "parent_of",
      "source": "generated_taxonomy",
      "to": "feature:generated.minimal.fixtures"
    },
    {
      "determinism": "rule",
      "edge_id": "e:product_root:feature:generated.settings.minimal:parent_of:1",
      "from": "product_root",
      "rel": "parent_of",
      "source": "generated_taxonomy",
      "to": "feature:generated.settings.minimal"
    },
    {
      "determinism": "rule",
      "edge_id": "e:feature:generated.minimal.fixtures:screen:MainActivity:parent_of:2",
      "from": "feature:generated.minimal.fixtures",
      "rel": "parent_of",
      "source": "generated_taxonomy",
      "to": "screen:MainActivity"
    },
    {
      "determinism": "rule",
      "edge_id": "e:feature:generated.settings.minimal:screen:SettingsActivity:parent_of:3",
      "from": "feature:generated.settings.minimal",
      "rel": "parent_of",
      "source": "generated_taxonomy",
      "to": "screen:SettingsActivity"
    },
    {
      "callee_name": "openSettings",
      "callsite_file": "fixtures/minimal_android/app/src/main/java/com/verifyfix/minimal/MainActivity.kt",
      "callsite_line": 21,
      "confidence": "regex_same_class",
      "determinism": "static_analysis",
      "edge_id": "e:function_symbol:fn:com.verifyfix.minimal.MainActivity.onCreate/1:function_symbol:fn:com.verifyfix.minimal.MainActivity.openSettings/0:calls:4",
      "from": "function_symbol:fn:com.verifyfix.minimal.MainActivity.onCreate/1",
      "rel": "calls",
      "source": "call_graph.json",
      "to": "function_symbol:fn:com.verifyfix.minimal.MainActivity.openSettings/0"
    },
    {
      "determinism": "static_analysis",
      "edge_id": "e:screen:MainActivity:screen:SettingsActivity:navigates_to:5",
      "from": "screen:MainActivity",
      "line": 32,
      "rel": "navigates_to",
      "to": "screen:SettingsActivity",
      "trigger": "l2:localIntent:L32",
      "via": "startActivity(local Intent)"
    },
    {
      "determinism": "static_analysis",
      "edge_id": "e:screen:MainActivity:ui_surface:activity_main:owns_ui:6",
      "from": "screen:MainActivity",
      "rel": "owns_ui",
      "source": "activity_main_spec.json",
      "to": "ui_surface:activity_main"
    },
    {
      "determinism": "static_analysis",
      "edge_id": "e:ui_surface:activity_main:ui_control:activity_main:hello:owns_ui:7",
      "from": "ui_surface:activity_main",
      "rel": "owns_ui",
      "source": "activity_main_spec.json",
      "to": "ui_control:activity_main:hello"
    },
    {
      "determinism": "static_analysis",
      "edge_id": "e:ui_surface:activity_main:ui_control:activity_main:fragment_container:owns_ui:8",
      "from": "ui_surface:activity_main",
      "rel": "owns_ui",
      "source": "activity_main_spec.json",
      "to": "ui_control:activity_main:fragment_container"
    },
    {
      "determinism": "static_analysis",
      "edge_id": "e:ui_surface:activity_main:ui_control:activity_main:btn_settings:owns_ui:9",
      "from": "ui_surface:activity_main",
      "rel": "owns_ui",
      "source": "activity_main_spec.json",
      "to": "ui_control:activity_main:btn_settings"
    },
    {
      "determinism": "static_analysis",
      "edge_id": "e:screen:SettingsActivity:ui_surface:activity_settings:owns_ui:10",
      "from": "screen:SettingsActivity",
      "rel": "owns_ui",
      "source": "activity_settings_spec.json",
      "to": "ui_surface:activity_settings"
    },
    {
      "determinism": "static_analysis",
      "edge_id": "e:ui_surface:activity_settings:ui_control:activity_settings:settings_header:owns_ui:11",
      "from": "ui_surface:activity_settings",
      "rel": "owns_ui",
      "source": "activity_settings_spec.json",
      "to": "ui_control:activity_settings:settings_header"
    },
    {
      "determinism": "static_analysis",
      "edge_id": "e:function_symbol:fn:com.verifyfix.minimal.SettingsFragment.onCreateView/3:implementation:inflates:1:evidence_in_file:12",
      "from": "function_symbol:fn:com.verifyfix.minimal.SettingsFragment.onCreateView/3",
      "rel": "evidence_in_file",
      "source": "inflates",
      "to": "implementation:inflates:1"
    }
  ],
  "meta": {
    "coverage": {
      "behavior_total": 0,
      "behaviors_with_call_chain": 0,
      "behaviors_with_entry_symbol": 0,
      "effect_path_attached_to_feature": 0,
      "effect_path_attached_to_screen": 0,
      "effect_path_total": 0,
      "effect_path_unmatched": 0,
      "effect_path_with_line": 0,
      "effect_path_without_line": 0,
      "feature_total": 2,
      "features_with_line_evidence": 0,
      "features_without_line_evidence": [
        "feature:generated.minimal.fixtures",
        "feature:generated.settings.minimal"
      ],
      "function_symbol_node_count": 4,
      "line_evidence_node_count": 1,
      "unresolved_call_count": 12
    },
    "edge_count": 13,
    "node_count": 16,
    "spec_tools_navigation": "navigation_graph.json",
    "taxonomy": {
      "feature_count": 2,
      "generated_assigned_screen_count": 2,
      "generated_feature_count": 2,
      "matched_screen_count": 2,
      "screen_total": 2,
      "unmatched_screen_count": 0
    }
  },
  "nodes": [
    {
      "evidence": {
        "launcher": "com.verifyfix.minimal.MainActivity",
        "manifest_application_id": "com.verifyfix.minimal"
      },
      "kind": "product_root",
      "label": "com.verifyfix.minimal",
      "node_id": "product_root"
    },
    {
      "evidence": {
        "representative_screens": [
          "MainActivity"
        ],
        "taxonomy": [],
        "taxonomy_source": "generated",
        "top_tokens": [
          "minimal",
          "fixtures",
          "android",
          "app",
          "src",
          "java"
        ]
      },
      "kind": "feature",
      "label": "Minimal Fixtures Android",
      "logical_feature_id": "generated.minimal.fixtures",
      "node_id": "feature:generated.minimal.fixtures"
    },
    {
      "evidence": {
        "representative_screens": [
          "SettingsActivity"
        ],
        "taxonomy": [],
        "taxonomy_source": "generated",
        "top_tokens": [
          "settings",
          "minimal",
          "fixtures",
          "android",
          "app",
          "src"
        ]
      },
      "kind": "feature",
      "label": "Settings Minimal Fixtures",
      "logical_feature_id": "generated.settings.minimal",
      "node_id": "feature:generated.settings.minimal"
    },
    {
      "evidence": {
        "navigation_graph": "navigation_graph.json"
      },
      "kind": "screen",
      "label": "MainActivity",
      "layout": "activity_main",
      "logical_feature_id": "generated.minimal.fixtures",
      "node_id": "screen:MainActivity",
      "projection": {
        "harmony": {
          "ability_name": "EntryAbility",
          "module": "harmony_entry",
          "route_placeholder": "pages/mainactivity/Index"
        }
      },
      "screen_class": "MainActivity",
      "screen_kind": "activity"
    },
    {
      "evidence": {
        "navigation_graph": "navigation_graph.json"
      },
      "kind": "screen",
      "label": "SettingsActivity",
      "layout": "activity_settings",
      "logical_feature_id": "generated.settings.minimal",
      "node_id": "screen:SettingsActivity",
      "projection": {
        "harmony": {
          "ability_name": "EntryAbility",
          "module": "harmony_entry",
          "route_placeholder": "pages/settingsactivity/Index"
        }
      },
      "screen_class": "SettingsActivity",
      "screen_kind": "activity"
    },
    {
      "evidence": {
        "class_name": "MainActivity",
        "confidence": "regex",
        "end_line": 28,
        "file": "fixtures/minimal_android/app/src/main/java/com/verifyfix/minimal/MainActivity.kt",
        "function_name": "onCreate",
        "signature": "savedInstanceState: Bundle?",
        "source": "function_symbols.json",
        "start_line": 12
      },
      "function_name": "onCreate",
      "kind": "function_symbol",
      "label": "MainActivity.onCreate",
      "node_id": "function_symbol:fn:com.verifyfix.minimal.MainActivity.onCreate/1",
      "signature": "savedInstanceState: Bundle?",
      "symbol_id": "fn:com.verifyfix.minimal.MainActivity.onCreate/1"
    },
    {
      "evidence": {
        "class_name": "MainActivity",
        "confidence": "regex",
        "end_line": 33,
        "file": "fixtures/minimal_android/app/src/main/java/com/verifyfix/minimal/MainActivity.kt",
        "function_name": "openSettings",
        "signature": "",
        "source": "function_symbols.json",
        "start_line": 29
      },
      "function_name": "openSettings",
      "kind": "function_symbol",
      "label": "MainActivity.openSettings",
      "node_id": "function_symbol:fn:com.verifyfix.minimal.MainActivity.openSettings/0",
      "signature": "",
      "symbol_id": "fn:com.verifyfix.minimal.MainActivity.openSettings/0"
    },
    {
      "evidence": {
        "class_name": "SettingsActivity",
        "confidence": "regex",
        "end_line": 10,
        "file": "fixtures/minimal_android/app/src/main/java/com/verifyfix/minimal/SettingsActivity.kt",
        "function_name": "onCreate",
        "signature": "savedInstanceState: Bundle?",
        "source": "function_symbols.json",
        "start_line": 7
      },
      "function_name": "onCreate",
      "kind": "function_symbol",
      "label": "SettingsActivity.onCreate",
      "node_id": "function_symbol:fn:com.verifyfix.minimal.SettingsActivity.onCreate/1",
      "signature": "savedInstanceState: Bundle?",
      "symbol_id": "fn:com.verifyfix.minimal.SettingsActivity.onCreate/1"
    },
    {
      "evidence": {
        "class_name": "SettingsFragment",